{
  "schema_version": 1,
  "capture": {
    "capture_id": "capture_20260831_033226_video",
    "tier": "video",
    "sensor_budget": [
      "manifest.json",
      "rooms.json",
      "video.mov",
      "video_meta.json"
    ],
    "device_model": "iPhone 13",
    "captured_at": "2026-08-30T22:02:26Z"
  },
  "pipeline": {
    "version": "0.1.0",
    "git_commit": "2f24b65",
    "run_at": "2026-08-31T00:21:53.911892+00:00",
    "command": "cozmo run benchmark/raw/capture_20260831_033226_video",
    "runtime_seconds": 4.9
  },
  "rooms": [
    {
      "id": "bedroom_1",
      "name": "Bedroom 1",
      "walls": [
        {
          "id": "A",
          "length": {
            "value": 2.8333,
            "ci_low": 1.9833,
            "ci_high": 3.6833,
            "unit": "m",
            "method": "floor_backprojection_camera_height_prior",
            "n_observations": 6,
            "notes": "Scale from a 1.45 m camera-height prior; interval set from measured error against tape ground truth."
          },
          "height": {
            "value": 2.9,
            "ci_low": 2.175,
            "ci_high": 3.625,
            "unit": "m",
            "method": "residential_prior_not_estimated",
            "notes": "Not estimated from the capture. A prior over ordinary residential ceilings, quoted as a range because the pipeline has no ceiling estimator yet."
          }
        },
        {
          "id": "B",
          "length": {
            "value": 3.0483,
            "ci_low": 0.0,
            "ci_high": 6.0965,
            "unit": "m",
            "method": "far_wall_lateral_extent",
            "n_observations": 6,
            "notes": "Known weak: measured 96% and 382% high on the two rooms with ground truth. Reported with an interval that covers that rather than withheld."
          },
          "height": {
            "value": 2.9,
            "ci_low": 2.175,
            "ci_high": 3.625,
            "unit": "m",
            "method": "residential_prior_not_estimated",
            "notes": "Not estimated from the capture. A prior over ordinary residential ceilings, quoted as a range because the pipeline has no ceiling estimator yet."
          }
        },
        {
          "id": "C",
          "length": {
            "value": 2.8333,
            "ci_low": 1.9833,
            "ci_high": 3.6833,
            "unit": "m",
            "method": "floor_backprojection_camera_height_prior",
            "n_observations": 6,
            "notes": "Scale from a 1.45 m camera-height prior; interval set from measured error against tape ground truth."
          },
          "height": {
            "value": 2.9,
            "ci_low": 2.175,
            "ci_high": 3.625,
            "unit": "m",
            "method": "residential_prior_not_estimated",
            "notes": "Not estimated from the capture. A prior over ordinary residential ceilings, quoted as a range because the pipeline has no ceiling estimator yet."
          }
        },
        {
          "id": "D",
          "length": {
            "value": 3.0483,
            "ci_low": 0.0,
            "ci_high": 6.0965,
            "unit": "m",
            "method": "far_wall_lateral_extent",
            "n_observations": 6,
            "notes": "Known weak: measured 96% and 382% high on the two rooms with ground truth. Reported with an interval that covers that rather than withheld."
          },
          "height": {
            "value": 2.9,
            "ci_low": 2.175,
            "ci_high": 3.625,
            "unit": "m",
            "method": "residential_prior_not_estimated",
            "notes": "Not estimated from the capture. A prior over ordinary residential ceilings, quoted as a range because the pipeline has no ceiling estimator yet."
          }
        }
      ],
      "ceiling_height": {
        "value": 2.9,
        "ci_low": 2.175,
        "ci_high": 3.625,
        "unit": "m",
        "method": "residential_prior_not_estimated",
        "notes": "Not estimated from the capture. A prior over ordinary residential ceilings, quoted as a range because the pipeline has no ceiling estimator yet."
      },
      "floor_area": {
        "value": 8.6367,
        "ci_low": 0.0,
        "ci_high": 22.4555,
        "unit": "m2",
        "method": "depth_times_width",
        "notes": "Product of two independent estimates; the interval multiplies, which is why it is wide."
      },
      "openings": [],
      "source_frames": 6
    },
    {
      "id": "hall",
      "name": "Hall",
      "walls": [
        {
          "id": "A",
          "length": {
            "value": 2.1901,
            "ci_low": 1.5331,
            "ci_high": 2.8471,
            "unit": "m",
            "method": "floor_backprojection_camera_height_prior",
            "n_observations": 7,
            "notes": "Scale from a 1.45 m camera-height prior; interval set from measured error against tape ground truth."
          },
          "height": {
            "value": 2.9,
            "ci_low": 2.175,
            "ci_high": 3.625,
            "unit": "m",
            "method": "residential_prior_not_estimated",
            "notes": "Not estimated from the capture. A prior over ordinary residential ceilings, quoted as a range because the pipeline has no ceiling estimator yet."
          }
        },
        {
          "id": "B",
          "length": {
            "value": 2.9397,
            "ci_low": 0.0,
            "ci_high": 5.8794,
            "unit": "m",
            "method": "far_wall_lateral_extent",
            "n_observations": 7,
            "notes": "Known weak: measured 96% and 382% high on the two rooms with ground truth. Reported with an interval that covers that rather than withheld."
          },
          "height": {
            "value": 2.9,
            "ci_low": 2.175,
            "ci_high": 3.625,
            "unit": "m",
            "method": "residential_prior_not_estimated",
            "notes": "Not estimated from the capture. A prior over ordinary residential ceilings, quoted as a range because the pipeline has no ceiling estimator yet."
          }
        },
        {
          "id": "C",
          "length": {
            "value": 2.1901,
            "ci_low": 1.5331,
            "ci_high": 2.8471,
            "unit": "m",
            "method": "floor_backprojection_camera_height_prior",
            "n_observations": 7,
            "notes": "Scale from a 1.45 m camera-height prior; interval set from measured error against tape ground truth."
          },
          "height": {
            "value": 2.9,
            "ci_low": 2.175,
            "ci_high": 3.625,
            "unit": "m",
            "method": "residential_prior_not_estimated",
            "notes": "Not estimated from the capture. A prior over ordinary residential ceilings, quoted as a range because the pipeline has no ceiling estimator yet."
          }
        },
        {
          "id": "D",
          "length": {
            "value": 2.9397,
            "ci_low": 0.0,
            "ci_high": 5.8794,
            "unit": "m",
            "method": "far_wall_lateral_extent",
            "n_observations": 7,
            "notes": "Known weak: measured 96% and 382% high on the two rooms with ground truth. Reported with an interval that covers that rather than withheld."
          },
          "height": {
            "value": 2.9,
            "ci_low": 2.175,
            "ci_high": 3.625,
            "unit": "m",
            "method": "residential_prior_not_estimated",
            "notes": "Not estimated from the capture. A prior over ordinary residential ceilings, quoted as a range because the pipeline has no ceiling estimator yet."
          }
        }
      ],
      "ceiling_height": {
        "value": 2.9,
        "ci_low": 2.175,
        "ci_high": 3.625,
        "unit": "m",
        "method": "residential_prior_not_estimated",
        "notes": "Not estimated from the capture. A prior over ordinary residential ceilings, quoted as a range because the pipeline has no ceiling estimator yet."
      },
      "floor_area": {
        "value": 6.4382,
        "ci_low": 0.0,
        "ci_high": 16.7394,
        "unit": "m2",
        "method": "depth_times_width",
        "notes": "Product of two independent estimates; the interval multiplies, which is why it is wide."
      },
      "openings": [],
      "source_frames": 7
    },
    {
      "id": "bedroom_2",
      "name": "Bedroom 2",
      "walls": [
        {
          "id": "A",
          "length": {
            "value": 3.301,
            "ci_low": 2.3107,
            "ci_high": 4.2913,
            "unit": "m",
            "method": "floor_backprojection_camera_height_prior",
            "n_observations": 6,
            "notes": "Scale from a 1.45 m camera-height prior; interval set from measured error against tape ground truth."
          },
          "height": {
            "value": 2.9,
            "ci_low": 2.175,
            "ci_high": 3.625,
            "unit": "m",
            "method": "residential_prior_not_estimated",
            "notes": "Not estimated from the capture. A prior over ordinary residential ceilings, quoted as a range because the pipeline has no ceiling estimator yet."
          }
        },
        {
          "id": "B",
          "length": {
            "value": 2.7481,
            "ci_low": 0.0,
            "ci_high": 5.4962,
            "unit": "m",
            "method": "far_wall_lateral_extent",
            "n_observations": 6,
            "notes": "Known weak: measured 96% and 382% high on the two rooms with ground truth. Reported with an interval that covers that rather than withheld."
          },
          "height": {
            "value": 2.9,
            "ci_low": 2.175,
            "ci_high": 3.625,
            "unit": "m",
            "method": "residential_prior_not_estimated",